=== START OF INFORMATION SECTION ===
Device Model: HGST HUS726T4TALA6L4
Serial Number: CLEAN123
SMART support is: Available - device has SMART capability.
SMART support is: Enabled

=== START OF READ SMART DATA SECTION ===
SMART overall-health self-assessment test result: PASSED

ID# ATTRIBUTE_NAME          FLAG     VALUE WORST THRESH TYPE      UPDATED  WHEN_FAILED RAW_VALUE
  5 Reallocated_Sector_Ct   0x0033   100   100   005    Pre-fail  Always       -       0
  9 Power_On_Hours          0x0032   090   090   000    Old_age   Always       -       12345
187 Reported_Uncorrect      0x0032   100   100   000    Old_age   Always       -       0
197 Current_Pending_Sector  0x0012   100   100   000    Old_age   Always       -       0
198 Offline_Uncorrectable   0x0010   100   100   000    Old_age   Offline      -       0
199 UDMA_CRC_Error_Count    0x003e   200   200   000    Old_age   Always       -       0

ATA Error Count: 0
SMART Self-test log structure revision number 1
No self-tests have been logged.
